{
  "formatVersion": 1,
  "name": "Ridge Run",
  "music": "audio/music/level2.ogg",
  "grid": [
    "................................................................",
    "................................................................",
    "................................................................",
    "................................................................",
    "................................................................",
    "................................................................",
    ".......................bbeb.....................................",
    "...........bbb....#...======..............bbbb..................",
    ".....c............#.......................====............bbb...",
    ".P...c..e.......c.#...........oo.r..............e........c....G.",
    "###########...######################....############...#########",
    "###########...######################....############...#########"
  ],
  "legend": {
    "#": {
      "tile": {
        "solid": true,
        "color": "#6b4f2a"
      }
    },
    "=": {
      "tile": {
        "solid": true,
        "color": "#3f7f3f"
      }
    },
    "P": {
      "playerStart": true
    },
    "G": {
      "goal": true,
      "color": "#ff3030"
    },
    "b": {
      "reward": {
        "value": 1,
        "color": "#ffe135"
      }
    },
    "c": {
      "object": "crate"
    },
    "o": {
      "object": "coconut"
    },
    "e": {
      "enemy": "beetle"
    },
    "r": {
      "enemy": "beetle",
      "facing": "right"
    }
  },
  "background": {
    "color": "#ffb37a",
    "layers": [
      {
        "image": "images/level2-sky.png",
        "scrollFactor": 0
      },
      {
        "image": "images/level2-mountains.png",
        "scrollFactor": 0.2
      },
      {
        "image": "images/level2-bushes.png",
        "scrollFactor": 0.7
      }
    ]
  }
}
