{
  "formatVersion": 1,
  "name": "Jungle Edge",
  "grid": [
    "............................................................",
    "............................................................",
    "............................................................",
    "............................................................",
    "............................................................",
    "..................................bbbb......................",
    "..............bb.................======.........bbb.........",
    ".................................................r..........",
    ".....bb.......##...............................=====........",
    "..P...........##..........e..c.c........o................G..",
    "####################...###################...###############",
    "####################...###################...###############"
  ],
  "legend": {
    "#": {
      "tile": {
        "solid": true,
        "color": "#6b4f2a"
      }
    },
    "=": {
      "tile": {
        "solid": true,
        "color": "#3f7f3f"
      }
    },
    "P": {
      "playerStart": true
    },
    "G": {
      "goal": true,
      "color": "#ff3030"
    },
    "b": {
      "reward": {
        "value": 1,
        "color": "#ffe135"
      }
    },
    "c": {
      "object": "crate"
    },
    "o": {
      "object": "coconut"
    },
    "e": {
      "enemy": "beetle"
    },
    "r": {
      "enemy": "beetle",
      "facing": "right"
    }
  },
  "background": {
    "color": "#87ceeb",
    "layers": [
      {
        "image": "images/level1-sky.png",
        "scrollFactor": 0
      },
      {
        "image": "images/level1-hills.png",
        "scrollFactor": 0.3
      },
      {
        "image": "images/level1-trees.png",
        "scrollFactor": 0.6
      }
    ]
  },
  "cutscene": "after-level1"
}
